### ISSUE TITLE
Transfer performance problem about spdy without ssl on port 80

### ISSUE THREAD

**Issue by zhangjing** [alibaba/tengine#524]
Hi

I make some performance test about spdy without ssl and find something maybe can be improved, or there is a solution I don't have got.
To illustrate the problem clearly , the test  case has been simplied as small as possible :
url "http://someip"
the returnd page is tengine homepage, 555 bytes

just send one request (rtt is 30ms , but the real response is 200ms+, I caputre the packet from server)

1413353694.741275 IP 10.18.22.12.55718 > 180.153.229.179.80: Flags [P.], seq 1:21, ack 1, win 256, length 20     (Client SETTINGS_INITIAL_WINDOW_SIZE)
1413353694.741314 IP 180.153.229.179.80 > 10.18.22.12.55718: Flags [.], ack 21, win 115, length 0
1413353694.741571 IP 180.153.229.179.80 > 10.18.22.12.55718: Flags [P.], seq 1:29, ack 21, win 115, length 28  (Server SETTINGS)
1413353694.769308 IP 10.18.22.12.55718 > 180.153.229.179.80: Flags [P.], seq 21:135, ack 1, win 256, length 114  (Client WINDOW_UPDATE STEAM and SYN_STREAM)
1413353694.817416 IP 180.153.229.179.80 > 10.18.22.12.55718: Flags [.], ack 135, win 115, length 0
1413353694.968587 IP 10.18.22.12.55718 > 180.153.229.179.80: Flags [.], ack 29, win 256, length 0 (DELAYED ACK)
1413353694.968638 IP 180.153.229.179.80 > 10.18.22.12.55718: Flags [P.], seq 29:890, ack 135, win 115, length 861  (SERVER SYN_REPLY STREAM and DATA STREAM)
1413353695.198569 IP 10.18.22.12.55718 > 180.153.229.179.80: Flags [.], ack 890, win 253, length 0

After strace the program , the nginx has called 
writev(3, [{"\200\3\0\2\0\0\1\34\0\0\0\3\0\16\1\361\376\0\0\0\t\0\0\0\10:versio"..., 292}], 1) = 292 <0.000028>
pread(10, "<!DOCTYPE html>\n<html>\n<head>\n<t"..., 555, 0) = 555 <0.000023>
writev(3, [{"\0\0\0\3\1\0\2+", 8}, {"<!DOCTYPE html>\n<html>\n<head>\n<t"..., 555}], 2) = 563 <0.000017>

but the delayed ack defer the real data sending , it make the trouble。
The problem is described in detail at http://en.wikipedia.org/wiki/TCP_delayed_acknowledgment
I think it's better add tcp_nodelay to the socketopt or induce some option in the conf for performance tuning

the suitation can been find after the first request (I send request serial, which is not common)

1413355405.654668 IP 10.18.22.12.56650 > 180.153.229.179.80: Flags [P.], seq 162:189, ack 1745, win 256, length 27   (SYN_STREAM)
1413355405.655049 IP 180.153.229.179.80 > 10.18.22.12.56650: Flags [P.], seq 1745:2037, ack 189, win 115, length 292   (SYN_REPLY STREAM)
1413355405.885367 IP 10.18.22.12.56650 > 180.153.229.179.80: Flags [.], ack 2037, win 255, length 0   (Delayed ack)
1413355405.885381 IP 180.153.229.179.80 > 10.18.22.12.56650: Flags [P.], seq 2037:2600, ack 189, win 115, length 563  (DATA STREAM)
1413355406.113454 IP 10.18.22.12.56650 > 180.153.229.179.80: Flags [.], ack 2600, win 253, length 0

I find tengine called writev twice ,first time send the syn_reply_stream , second time send data stream
Maybe It's not efficient enough 。spdy over ssl just send the syn_reply and data stream together in one writev

Thanks
Jing
